title,description,creators,resource_type,publication_date,access_record,access_files,file_paths,publish
"Climate Change Impact Dataset","A comprehensive dataset analyzing climate change impacts on agricultural productivity in Mediterranean regions","Maria Rossi;;University of Rome | Giovanni Bianchi;;CNR",dataset,2024-01-15,public,public,,yes
"AI Model Training Results","Results from training a deep learning model for image classification","Alice Smith;;MIT | Bob Johnson;;Stanford University",publication-article,2024-02-20,public,public,,yes
"Survey Data: European Research Trends","Survey responses from 5000 researchers across Europe about current research trends and challenges","Francesco Verdi;;University of Florence | Emma White;;University of Oxford",dataset,2024-03-10,public,restricted,,yes
"Open Source Software Package","A novel Python package for statistical analysis of scientific data","John Doe;;Independent Researcher",software,2024-04-05,public,public,,yes
"Historical Documents Collection","Digitized collection of 18th century scientific manuscripts","Laura Neri;;National Library | Marco Gialli;;Archives Institute",other,2024-05-12,public,public,,yes
